video;onca;caseiro;fake news;ironia;notícia;Conservacionistas;comment_text
video2;neutro;neutro;sim;não;ruim;neutra;Pelo que o sobrinho dele falou das imagens das câmeras não foi assim<br><br>Ele saiu da casa e foi pela passarela olhar os barcos, a onça já tava esperando ele escondida por trás de uns coqueiros e quando ele viu ela, correu de volta pra tentar entrar na casa, mas ela foi mais rápida e correu por baixo da passarela, chegou na parte de trás antes dele e o cercou, quando ele tentou correr pro barco novamente, ela correu pela beirada da passarela, saltou sob a grade e já foi em cima dele
video2;neutro;neutro;não;não;ruim;neutra;Nas imagens não foi assim
video2;neutro;neutro;não;não;ruim;neutra;a onça já foi criada junto com ele e ele fez umas montagens como se estivesse atacando ele😊😂
video2;neutro;neutro;não;não;neutra;neutra;A gente tem que ser esperto
video2;neutro;neutro;não;não;ruim;neutra;Muito confusa essa simulação.  Certeza que não foi assim
video2;negativo;positivo;não;não;ruim;neutra;Essa simulação ficou pessima,  as imagens verdadeiras existem, quem sabe algum dia cai na rede, foi um final triste pro Jorge e terrivel para a familia, mas pelo menos ele morreu fazendo o que gostava junto da natureza! Descanse em paz Jorge! Meus sentimentos a todos os familares e amigos! Essa semana uma onça matou 7 carneiros no meu vizinho e mais 2 cachorros em outra propriedade!
video2;neutro;neutro;não;não;neutra;neutra;"05;30 da manhã foi o ataque,ainda meio escuro, imagina enxergar uma onça no escuro, no claro já é dificil"
video2;neutro;positivo;não;não;neutra;neutra;Coitado do homem
video2;neutro;neutro;não;não;neutra;neutra;simulação fico incrível!!! nota 2.
video2;neutro;neutro;não;não;neutra;neutra;Tudo virtual se fosse verídico alguém teria gritado por tanto tudo mentira
video2;neutro;neutro;não;sim;ruim;neutra;Se a cabeça dele foi estourada no momento do Ataque, como ela levou ele íntegro? Simulação lerda.
video2;negativo;neutro;não;não;neutra;neutra;Eu trompo com onca todo dia e todas elas correm de mim e dos vaqueiros tendeu??
video2;neutro;neutro;sim;não;neutra;neutra;Tem coisa aí que  é melhor não falar. Veja a polícia checou a câmera e lá tem gravação  desde janeiro mas do dia do ataque não tem.. O Jorge tinha quase  20 anos trabalhado ali. E queria acertar e sair e aí o que me diz?
video2;neutro;neutro;sim;não;neutra;neutra;"Onça que matou o Jorge foi morta, Será que é verdade gente?<br><a href=""https://www.youtube.com/watch?v=7f1QaXKiSlw"">https://youtu.be/7f1QaXKiSlw?si=qyZub5GXj7m3oz0M</a>"
video2;negativo;negativo;não;não;neutra;neutra;Cara vacilou demais  essa e a verdade se eu estou num lugar desse ela nao me pegava pq antes dela me pega eu passava o burraio nela
video2;neutro;neutro;não;não;neutra;ruim;Pessoal fala merda duzendo que onça nao Ataca não sabe e de nada..
video2;negativo;positivo;não;não;neutra;neutra;Essas praga ja era pra nem existi mas.a vida humana em primeiro lugar
video2;neutro;neutro;não;não;neutra;neutra;O q eu acho ,é q essa historia ta mal contada...agora quem sabe da verdade...
video2;neutro;neutro;não;não;neutra;neutra;Que video bem feito parece até ter saido de um jogo da rockstar.<br><br>Alguem sabe o nome da ia que cria um video dessa qualidade ?
video2;neutro;neutro;não;não;neutra;neutra;"<a href=""https://www.youtube.com/watch?v=HcD2Wm3k4Ls"">https://youtu.be/HcD2Wm3k4Ls?si=Q9AJolZOU_9E_R1Q</a><br><br>Só pra ter uma noção do estrago que ela faz. No video é um leopardo."
video2;neutro;neutro;não;não;neutra;neutra;DEUS QUE TE  LIVRE DA BOCA DO CONHADO DO DE JORGE
video2;neutro;neutro;não;não;neutra;neutra;Pra mim, o Pantanal é habitat dos animais, fico pensando no Almir Sater , como consegue viver lá
video2;neutro;neutro;sim;não;neutra;neutra;Ele deveria estar sempre armado... Nada que um 38 na cintura não resolveria!.. Já fica o alerta!.. Onça rondando casa de família, para pegar uma criança são 2 segundos...Todo cuidado é pouco.
video2;neutro;neutro;não;não;ruim;neutra;Q.bosta de simulação
video2;neutro;neutro;não;não;ruim;neutra;Vídeo falso
video2;neutro;neutro;não;não;neutra;neutra;🙏🙏🙏🙏🙏
video2;neutro;neutro;sim;não;ruim;neutra;Ele estava no meio da passarela com corrimão, ela esmagou o crânio dele ali mesmo<br>Se ele correu,  e ela o alcançou ali, somente quem viu as imagens das cameras para saber<br>Outra coisa, dificilmente eles erram a cabeça ou pescoço na hora do ataque
video2;neutro;neutro;não;não;neutra;ruim;Não  existe expecialista pra isso ai  a sociedade.que saber de.tudo  . Tem jente enventando muita coisa
video2;neutro;positivo;não;não;neutra;neutra;Acho q se já tnh visto os rastros e a briga delas dentro do terreno tnh q ter dado 1s tiro pra assustar sei lá,  andar armado , fica esperto que vá em paz deus abençoe
video2;neutro;neutro;não;não;neutra;neutra;Para bens
video2;neutro;neutro;não;não;ruim;neutra;"Simulação toda de mentira e errada cara nem n&#39;água caiu kk"
video2;neutro;neutro;não;não;ruim;neutra;Poco bosta😂
video2;neutro;neutro;não;não;neutra;neutra;Que aflição
video2;neutro;neutro;não;sim;neutra;neutra;😂 a onça levando o cara😂😂 nao e pra da risada mais tu e doido 😢
video2;negativo;negativo;não;sim;neutra;neutra;Mds eu vejo varias pessoas dizendo coitada da onça maldito homem q é o culpado mais se fosse um familiar n reagiriam assim iam pensar em matar ela eu jamais em sã conciencia iria defende-la se predasse animais da minha residencia ou atacasse alguem o bicho é astuto ai n ataca humanos maior mentira contada se puder ela pega sim coitado desse senhor e da familia dele que Deus conforte nunca nunca msm q eu ficar do lado de um bicho desse acho lindo mais longe de mim dos meus cachorros e animais da fazenda e principalmente minha familia me julguem mais é o q acho o povo q ta com dó adota pra cuidar entao😊 e boa sorte
video2;neutro;neutro;não;não;neutra;neutra;Você não tem prova que é a onça que foi pega abra os olhos podem ter sido outra por que que tem que ser esta
video2;neutro;neutro;não;não;ruim;neutra;Simulação com IA = Mentira
video2;neutro;neutro;sim;não;ruim;neutra;NÃo foi asim , no local habia restos de masa encefalica y pedazos do craneo , a onça quebro o craneo , mato ele e levo pra comer . De jeito cuando encontraron as pernas de ele , a onça estaba se alimentando
video2;neutro;neutro;não;não;ruim;neutra;Medida foi na cabeça e não  mostra
video2;neutro;neutro;não;não;ruim;neutra;Que trem mais mal feito. Isso não tem nada parecido!
video2;neutro;neutro;não;sim;ruim;neutra;Enfadonha a animação kkkkk
video2;neutro;neutro;não;não;boa;neutra;muito interessante isso, IA pra reconstituição. Parabéns pelo trabalho.
video2;neutro;neutro;não;não;neutra;neutra;Onde faz essa simulação?
video2;neutro;neutro;não;sim;ruim;neutra;Que bosta kk
video2;neutro;neutro;não;sim;ruim;neutra;Tudo errado 😂 essa IA é da china 😂
video2;neutro;neutro;não;não;ruim;neutra;Nao esatamame do que oquore  mentirosa as fala de vcs
video2;neutro;neutro;não;não;ruim;neutra;Nem parecido
video2;neutro;neutro;sim;não;ruim;neutra;Ela já pulou direto na cabeça dele...Essa simulação não tá real
video2;neutro;neutro;não;não;ruim;neutra;E mais um adendo,isso não aconteceu de noite
video2;neutro;neutro;sim;não;ruim;neutra;Essa animação tá errada.ela atacou mordendo na nuca e arrancando parte de trás do crânio fazendo vazar a massa encefálica,logo,ele teve morte cerebral instantânea.ela já arrastou o corpo morto .tá tudo errado aí
video2;neutro;neutro;sim;não;ruim;neutra;Especialista afirmaram que o Jorge teve o crânio esmagado no primeiro ataque da onça ele teve uma morte instantânea. Não foi como nessa simulação que o homem foi arrastado vivo!
video2;negativo;neutro;não;não;neutra;boa;Se os biólogos afirmam que a onça tem medo do ser humano, essa daí perdeu o medo e , pior, ela considera o ser humano ALIMENTO para ela. <br>Onde esse animal estiver solto ser humano nenhum poderá chegar , nem de longe.<br>Não será mais correto com os seres humanos sacrificar esse animal?
video2;neutro;neutro;não;não;neutra;neutra;Felino com a mordida mais forte do mundo não dá para vacilar
video2;neutro;neutro;não;não;ruim;neutra;Ótima simulação.. Já que foi feita por um menino de 7 anos...
video2;neutro;neutro;sim;não;ruim;neutra;A onça cravou os dentes no crânio da vítima antes de arrasta-lo.
video2;neutro;neutro;não;não;neutra;neutra;Como foi esse caso não ⛔ como foi esse caso da onça
video2;neutro;neutro;não;não;ruim;neutra;Nossa que merda... Apaga isso
video2;neutro;neutro;não;sim;neutra;neutra;😅
video2;neutro;neutro;não;não;neutra;neutra;Meu Deus 😢😢😢😢😢
video2;neutro;neutro;não;não;ruim;neutra;Merda de simulação sem sentido e sem lógica.
video2;neutro;neutro;não;sim;ruim;neutra;Com q os miolhos Derli tarva na ponte. e a onça aí carregando ele e ele gritando😅
video2;neutro;neutro;não;não;ruim;neutra;Nada a ver essa simulação
video2;neutro;neutro;não;não;ruim;neutra;Não foi assim
video2;neutro;neutro;não;não;neutra;neutra;Força geralmente quando ela tá que ela morde o cranio
video2;neutro;neutro;não;não;boa;neutra;Ficou show de bola nota 10 Joinha, qual IA vc usa para gerar videos?, <br>eu tinha uma que vc contava uma acontecimento e detalhes da cena ela gerava o vídeo 30segundos, mas o site saiu fora do ar.
video2;neutro;neutro;não;não;boa;neutra;Muito interessante este vídeo.<br>Mas assista o vídeo, de Ataque de onça no município de Ponto Belo-es.<br>Você vai ver a força descomunal de uma onça...
video2;neutro;neutro;não;sim;ruim;neutra;Ficou bom, nota zero
video2;neutro;neutro;não;não;neutra;neutra;Segundo o áudio do sobrinho do caseiro atacado, exposto no canal Indomáveis, aqui no YouTube, a cabeça do Jorginho teria sido esmagada quando a onça pulou em cima dele. Se assim foi ou não, espero que ele não tenha sofrido muito e por muito tempo.
video2;neutro;neutro;não;não;ruim;neutra;Mentira não foi assim
video2;neutro;positivo;não;não;ruim;neutra;RESPEITEM A FAMILIA ENLUTADA, ESSE VIDEO DE IA NAO CORRESPONDE AOS FATOS, TUDO PRA GANHAR LIKE, LIXOOO DE BLOGUEIROS OPORTUNISTAS.
video2;neutro;neutro;sim;não;neutra;neutra;Nem um felino ataca pelas costa
video2;neutro;negativo;não;não;neutra;neutra;Muito triste ele sabia do risco mas mesmo assim continuou la
video2;neutro;neutro;não;sim;neutra;neutra;parece o indiana Jonas
video2;neutro;neutro;não;não;neutra;neutra;Acho que ele estava era sentado onde tem o sangue quando ela atacou ele.
video2;neutro;neutro;não;não;ruim;neutra;Esse vídeo é virtual! N é o verdadeiro !
video2;neutro;neutro;não;não;ruim;neutra;Quem não tem o fazer é foda
video2;negativo;positivo;não;não;neutra;neutra;Mas  pelo menos  a Onça que  matou o  Jorge deveria ser  sacrificada  Sim ,  em respeito aos Familiares  , já que ela a Onça  pegou gosto  pela Carne humana ,  nâo tem mais volta ,  poderia fazer  outras Vitimas
video2;negativo;neutro;não;sim;neutra;neutra;"<a href=""https://www.youtube.com/watch?v=rHEdp2RjYeE"">https://youtu.be/rHEdp2RjYeE?si=p63SSFZSl6HYJoiV</a><br>Vão dar cabo na Onça você concorda?"
video2;neutro;neutro;não;não;neutra;neutra;Desmatam a natureza, constrói mansões afasta os animais do seu habitat , e esperam oq dos animais que calçam pra sobreviver??
video2;neutro;negativo;não;não;neutra;neutra;Acidente por falta de cuidado , as jurarcas não se alimentam de Humanas , mas o Animal que matambm no Brasil , outras cobras, os mosquitos , o.Aedes mata mais que cobras! Só não comem Humanos , o Fato desta onças comerem a carne Humana deve ser investigado,  Atacar o Ser Humano , o Java Porco Atacam ,  invadem e atacam, morar no Mato sem Cachorro ? Naquele Locas no mínimo 5 cachorros para tomar conta do.perimetro evitar ataques,   todas as chacaas precisam ter cachorros , e uma questão de segurança! Um absurdo não.ter cachorros naquele lugar cheio de animais Selvagens, se tem.onça e ligar Selvagem ,óbvio,,Cães Pastores são usados a centenas de anos para proteger o Gado e os Humanos , no mundo , onças Pardas , Tigres , e lobos , ataques de lobos nos USA e Canadá por exemplo,  um erro imaginar que Onças pintadas convivem bem com Humanos e pode até ser Bicho de estimação,  Erro Grave ! Acreditar que onças não atacam ser Humano ! mesmo a Onça Parda atacam , depende da situação,  Elas caçam.Humanos , não!  Caçar é atacar são cousas Bem  diferentes , vários animais Selvagens atacam seres Humanos ! Caçar para comer apenas alguns,   outra mentira é que as Orcas não atacam.o ser Humano , mesma que as onças,  não caçam não se alimentam,  mas podem atacar sim ! Depende!  Arriscar ser atacado por um animal poderoso como as Onças e  falta de informação! O governo deve Obrigas os Propietarios de sítios,  pesqueiro onde tem incas a ter cachorros.mimino 4 por questões dr segurança dos Humanos que morar naquele local , deveriam ter Sarue também. Cobras invadem as casas
video2;neutro;neutro;não;não;ruim;neutra;Que merda de simulação
video2;neutro;neutro;sim;não;ruim;neutra;Essa simulação ficou uma besta, você não acompanhou o relato dos caras que viram as imagens das câmeras mostrando o ataque
video2;neutro;neutro;não;não;ruim;neutra;Isso é falso
video2;neutro;neutro;não;não;neutra;neutra;Na época da novela Pantanal eu comecei a ter vontade de conhecer, mas depois desse caso eu deixei pra lá, melhor eu ficar aqui mesmo, tenho outras opções.
video2;neutro;neutro;não;não;neutra;neutra;Desespero que ele deve ter sentido 😢
video2;neutro;neutro;não;não;neutra;neutra;"<a href=""https://www.youtube.com/shorts/dSVYdUyddOQ"">https://youtube.com/shorts/dSVYdUyddOQ?si=sydW-Iodazciw0XO</a>"
video2;neutro;neutro;não;não;ruim;neutra;Acho que nao foi bem assim na agua
video2;neutro;neutro;não;não;ruim;neutra;Que bost😂
video2;neutro;neutro;não;não;ruim;neutra;Muito fraquinha èssa simulaçaõ
video2;neutro;neutro;não;não;neutra;neutra;Verdade
video2;negativo;neutro;não;não;neutra;neutra;Humanos sofrendo em hospitais sem tratamento   adequado, agora essa onça assasina todo esse cuidado.  Mete bala lago é claro que essa onça aprendeu que humanos é presa facil e jamais poderá ser solta
video2;negativo;neutro;não;não;neutra;neutra;Eu tenho pavor de onça
video2;neutro;neutro;sim;não;neutra;neutra;A onça já havia finalizado na ponte mordendo o crânio e depois arrastou o corpo . Isso é culpa das pessoas que alimenta esses animais acaba procurando o ser humano a lhes darem comida e eventualmente podem atacar
video2;neutro;neutro;não;não;neutra;neutra;Cadê a filmagem.
video2;neutro;neutro;não;não;ruim;neutra;Povo ridículo sem noção deboche com o cara que foi atacado pela onça, ficar fazendo esses vídeos sencionalista barato pra poder ganhar vius em cima da desgraça do o homem que morreu coitado, ninguém viu nada disso acontecer com o homem
video2;neutro;neutro;não;não;ruim;neutra;Vídeo falço esse
video2;neutro;neutro;não;sim;ruim;neutra;Agora lascou,nem a polícia sabe como foi e vem um ser querer simular o que uma perícia técnica nem foi concluída 😅 menos ,bem menos ! Tudo tem limite,respeite a inteligência humana.
video2;neutro;neutro;não;não;neutra;neutra;Porque ele não tinha cachorro?
video2;neutro;neutro;sim;não;ruim;neutra;Não foi assim não, dizen que ele saiu pra buscar mel ela já tava  na espera dele, porque já o vigiava a dias,, estava só esperando o momento exato!!
video2;neutro;neutro;sim;não;ruim;neutra;Segundo falam que o caseiro estava deitado e distraído e não foi assim não
video2;negativo;positivo;não;não;neutra;neutra;Eu querendo o tempo todo saber como foi o ataque pra ter pelo menos noção do que o homem passou,e só vejo falar da onça 🤦🏻🙆🏻🙆🏻
video2;negativo;neutro;sim;não;neutra;neutra;O ser humano não tem valor !<br>Só fala desta onça feroz ainda diz que estava velha Affff.<br>Imagina se estivesse nova .
video2;neutro;neutro;sim;não;neutra;neutra;Ja ta rolando o verdadeiro video que as câmeras filmou tudo
video2;neutro;neutro;não;não;neutra;neutra;Muito estranho
video2;neutro;neutro;não;não;ruim;neutra;Tá parecendo um Tigre<br>Onça é menor
video2;neutro;neutro;não;não;ruim;neutra;Não tem nada a ver
video2;neutro;neutro;não;não;neutra;neutra;Foi mais ou menos assim
video2;neutro;neutro;não;não;ruim;neutra;Meu pai viu esse vídeo e achou que era verdade... Que aconteceu desse mesmo jeito..... As IA tem um poder enorme sobre as pessoas mesmo viu!
video2;negativo;neutro;não;não;neutra;neutra;E bom que a onça morra
video2;neutro;neutro;não;não;neutra;neutra;"<a href=""https://www.youtube.com/watch?v=IStPGquMThA"">https://youtu.be/IStPGquMThA?si=hOZ7d1yI0O-5IJdx</a>"
video2;neutro;positivo;não;não;neutra;neutra;Minha gente por favor deixa esse homem descansar em paz Ora pela família para Deus consolar a família deixa esse homem em paz esse ciúme de homem descansar em paz já foi é o tempo todinho isso respeita a família lutada
video2;neutro;positivo;não;não;neutra;neutra;Muito triste esse acontecimento 😢
video2;neutro;neutro;não;não;neutra;neutra;Qui foi assim deu muito tempo de reagir uai
video2;neutro;neutro;não;não;ruim;neutra;Qualquer um sabe que não foi assim
video2;neutro;neutro;não;não;ruim;neutra;Esse fio de além de ser babaca é falso
video2;neutro;neutro;não;não;ruim;neutra;documentário distorceu os fatos para romântizar. não teve isso de sentirem falta e decidirem procurar. as 6 da manhã pescadores amigos do Jorge  chegaram no local para comprar mel e se depararam com sangue e pedaços do corpo na ponte de madeira. acionaram a polícia e os bombeiros e iniciaram a procura pelo corpo. a onça voltou para proteger sua comida. eles enterram a caça com folhas e voltam para comer quando tem fome.
video2;neutro;neutro;não;sim;ruim;neutra;Foi exatamente assim, confia
video2;neutro;neutro;não;sim;neutra;neutra;Kkkk😂
video2;neutro;neutro;não;sim;neutra;neutra;Os humanos matam milhões de animais pra se alimentar...mais um animal não pode?
video2;negativo;neutro;não;não;neutra;neutra;Detroit become human está cada vez mais real
video2;neutro;neutro;não;não;ruim;neutra;Mas que besteira
video2;negativo;neutro;não;não;neutra;neutra;Onça tem que ser tratada como um animal selvagem esse não é o primeiro que ela mata e come esta viciada
video2;neutro;neutro;sim;não;ruim;neutra;Nao foi assim ! Relato do sobrinho por audio disse que o seu jorge viu a onça  , tentou voltar p casa , ela atalhou ele , ele tentou ir pro barco novamente, ela bloqueou de novo e ja atacou no rosto dele
video2;neutro;neutro;não;não;neutra;neutra;Se ele tivesse armado e atirasse c certeza não seria morto de, fora se tivesse cachorro z
video2;neutro;neutro;não;não;ruim;neutra;Simulação mal feita
video2;neutro;neutro;não;não;ruim;neutra;simulação fake, só depois de perícia e investigação da para dizer alguma coisa, infelizmente as pessoas fazem de tudo por likes!
video2;neutro;neutro;não;sim;ruim;neutra;Que merda de vídeo kkkkkkk
video2;neutro;neutro;não;não;ruim;neutra;Mas que animação ridícula, os felinos atacam direto no pescoço....
video2;neutro;neutro;não;não;ruim;neutra;Segundo o que o sobrinho dele falou que viu nas gravações não foi assim não.
video2;neutro;neutro;não;não;ruim;neutra;Nada aver, o ataque não foi assim
video2;neutro;negativo;não;não;neutra;neutra;Eu acho q ele deu mole,se sabe q tem inimigo na qbrada fka preparando.e ele sabia❤
video2;neutro;neutro;não;não;ruim;neutra;bando de vagabundo tá querendo ganhar com a morte de trabalhador
video2;neutro;neutro;não;não;ruim;neutra;Nada haver, obviamente não foi assim.
video2;neutro;neutro;não;não;ruim;neutra;Com certeza n foi assim
video2;neutro;neutro;sim;não;ruim;neutra;Onça pega na cabeça e depois de matar carrega a presa. Nunca vi uma onça carregar com as patas ainda mais com a presa viva 😂😂😂 vídeo horrível
video2;neutro;neutro;não;não;ruim;neutra;Só trouxa para acreditar nisso
video2;negativo;neutro;não;não;neutra;neutra;Essa onça deve ser sacrificada e da carne dela fazer um belo churrasco.<br>Nenhum animal da natureza deve se meter com o bicho homem.
video2;negativo;neutro;não;não;neutra;neutra;Era pra ser morta tambem a onça
video2;negativo;neutro;não;não;neutra;neutra;O animal precisa ser sacrificado. Depois que ele prova carne humana, sempre vai atacar humanos.
video2;neutro;neutro;não;não;neutra;neutra;E não pode dar as costas para onça
video2;neutro;negativo;não;não;neutra;neutra;O Jorge não deveria ter dado as costas para onça ele deveria ter ficado mais alerta olhando e ele deveria estar armado
video2;neutro;neutro;não;não;ruim;neutra;Não foi assim
video2;neutro;neutro;não;não;ruim;neutra;montagem
video2;positivo;neutro;não;sim;neutra;neutra;Depois disso a onça vai comprar carne no açougue porque caçar no seu habitat não pode mais
video2;neutro;neutro;não;não;neutra;neutra;Ala matou ele na hora  já arrastou ele morto
video2;negativo;neutro;sim;não;neutra;neutra;Na verdade a onça já vinha amanssando ele a dias
video2;neutro;neutro;não;sim;neutra;neutra;Kkkk
video2;neutro;neutro;não;não;ruim;neutra;Nada vê essa simulação q fez nem sabe o q é uma onça orivel
video2;neutro;neutro;não;não;ruim;neutra;Mentira. É uma encenação barata
video2;neutro;neutro;não;não;ruim;neutra;Isso é inteligência artificial. Povo acha que todo mundo é troxa   e idiota
video2;neutro;neutro;não;não;ruim;neutra;Nada haver
video2;neutro;neutro;não;não;ruim;neutra;Até minha imaginação consegui ser melhor do que essa simulação
video2;neutro;neutro;não;não;ruim;neutra;Você está corretamente certo......não foi assim mesmo não <br>Só quem vive na natureza tem o conhecimento evidente
video2;neutro;negativo;não;não;neutra;neutra;Bom, falo por mim, se eu morasse ou passasse um tempo nesses locais de mato, só sairia com minha espingarda ou arma de porte capaz de abater um animal desses. Acho que houve imprudência!
video2;neutro;neutro;não;não;ruim;neutra;😮 Que absurdo, falta de respeito, denunciar!
video2;neutro;neutro;não;não;ruim;neutra;Não foi assim porque até porque quando ele foi atacado ele tava em cima de uma ponte
video2;neutro;neutro;não;não;ruim;neutra;Onça com rabo de leopardo. Quem  fez a animação entende de computação,  mas nada de animais.
video2;neutro;neutro;não;não;ruim;neutra;Vai achar o que faz...
video2;neutro;neutro;não;não;neutra;neutra;Ficam com essas teorias tiradas do olho d......aí um animal que sofre com  colecionadores, caça, queimadas, doenças, etc....fica demonizada igual ao tubarão que tem menos incidente que abelhas.
video2;negativo;neutro;não;não;neutra;neutra;A onça quando ta choca é um perigo mortal
video2;neutro;neutro;não;não;neutra;neutra;Se ele tivesse com uma peixeira, o desfecho dessa história seria outro...
video2;neutro;neutro;não;não;ruim;neutra;De mais falso  nao tem lugar 🖕👎
video2;neutro;neutro;sim;não;ruim;neutra;Nada a haver ela o encurralou na grade pulou por cima da mesma prensou sua cabeça e esmagou seu crânio e saiu com ele na boca já morto
video2;negativo;neutro;não;não;neutra;neutra;eu fosse filho ou sobrinho do seu Jorge essa onça ñ tava viva mas n eu podia ir no inferno atrás dela mas eu ia bem armado fazia um estrago feio com ela n tinha negócio de ibamar no meio n .. eu acabava com essa onça.. até hoje eu vivo de roça de lavoura se eu der de cara com um bicha dessa nos sea acaba na msma hora..
video2;neutro;neutro;não;não;ruim;neutra;É um tanto desrespeitoso analisar dessa forma o ataque com o homem olhando para cima como se tivesse contando as estrelas e por hora parado, com certeza o ataque foi de surpresa sim, talvez ele estaria destraido com algum a fazer ou mesmo caminhando e foi pego Provavelmente  pelas costas, mas a analise foi muito debochada. Logo aparece um idiota ai pra falar que eu tava la e porque nao ajudei o jorge.
video2;neutro;neutro;não;não;neutra;neutra;Pelo que o parente falou, ela atacou a cabeça dele e esmagou ela, provável que ele morreu nesse momento, depois foi arrastado já morto.
video2;neutro;neutro;não;não;ruim;neutra;Nada a ver
video2;neutro;positivo;não;não;ruim;neutra;Nem chapéu caiu sendo que cabeça foi esmagado,essa IA deve ser do Paraguai...
video2;neutro;neutro;não;não;ruim;neutra;Isso que aconteceu com o sr: não é caso de ficarem fazendo piada não , deveriam respeitar o momento triste , agora  toda hora tem uns comédia inventado vídeo , fazendo simulações do ocorrido , para ganhar seguidores, tirar proveito da situação que ocorreu como caseiro ! Vamos respeitar!
video2;neutro;neutro;não;não;ruim;neutra;Meu Deus parem com isso, tenham empatia pela família e amigos
video2;neutro;neutro;não;não;ruim;neutra;Rídiculo.
video2;neutro;neutro;não;não;neutra;neutra;Não entendo por que um lugar cheio de câmeras e nenhuma gravou nada .eu digo a hora exata do ataque
video2;neutro;neutro;não;sim;ruim;neutra;Tem gente q faz de tudo para ganhar views😂
video2;neutro;neutro;sim;não;ruim;neutra;Totalmente por fora, ele pegou em cima da ponte
video2;neutro;neutro;não;sim;ruim;neutra;Jura que a onça levou ele com a pata? Kkkk
video2;neutro;neutro;não;sim;ruim;neutra;😂😂Tudo por like inventa uma história pelo amor de Deus , suposições bestas  vc não estava lá vc não viu,, não existe essa de meio termo ou vc v
video2;neutro;neutro;não;não;ruim;neutra;Rapaz isso aí não tem nada haver você já viu como que a onça pega  seus alimentos por exemplo o jacaré.
video2;neutro;neutro;não;não;ruim;neutra;Nada a ver
