video;onca;caseiro;fake news;ironia;notícia;Conservacionistas;comment_text
video0;neutro;neutro;não;não;neutra;;Eu conheço ele não sei o que ele é meu minha avó mostrou um vídeo dele😢😢😢😢😢😢😢😢😢😢😢😢
video0;negativo;neutro;não;não;neutra;;Porra nem uma agente mata na hora essa porra de onça.  É tiro na cabeça quantas aparecer.
video0;neutro;neutro;não;sim;neutra;;Cria ela no STF😂😂
video0;neutro;neutro;não;não;neutra;;😢😢Mds
video0;negativo;neutro;não;não;neutra;;Se fosse o contrário o final seria o mesmo. se vivo, estaria humilhado é traumatizado por insultos e ofensas
video0;positivo;neutro;não;não;neutra;;É...elas estão no habitat delas.....
video0;negativo;neutro;não;não;neutra;;p mim esse bicho tinha ser estinto e perigoso Mater vivo
video0;neutro;neutro;não;não;neutra;;Agora me lembrei daquele 🎥 a sombra e a escuridão dois leões em tsavo na África come 100 homens hindus e muçulmanos o filme 🎥 é fatos reais com Kelvin kostner e Michael Douglas.
video0;negativo;neutro;sim;não;neutra;;Parabéns pra eles serviço bem feito <br>Mais esse lugar está faltando comida para as onças se não ela não teria atacado para comer um ser humano
video0;neutro;neutro;não;não;neutra;;Que lindoo esse animal
video0;negativo;neutro;não;não;neutra;;A minha ligaçao é pro ibama é para irem buscar o corpo Tessa porcaria 🎉
video0;negativo;neutro;não;não;neutra;;Na minha opinião essa onça de veria passar pelo processo de eutanásia para evitar mais animais na região da propriedade pois se ela for solta talvez ela vá atrás de humano novamente
video0;positivo;neutro;não;não;neutra;;Como ela é linda 🐆
video0;neutro;neutro;não;não;boa;;Parabéns pelo vídeo 👏🏻👏🏻👏🏻👏🏻 bem direto e sem mentiras.
video0;neutro;neutro;não;não;neutra;;Precisamos ter cuidado com as palavras o cara falou a onca vai comer o jorge e comeu , devemos so falar coisas boas, aprenda
video0;neutro;neutro;não;sim;neutra;;Boa noite tem que levar pra Brasília pra subir a rampa e dá um abraço no Lula
video0;neutro;neutro;não;sim;neutra;;Solta ela lá no hospital pá come o bozó 😂😂😂😂😂
video0;positivo;neutro;não;não;neutra;;Na minha opinião, faz qualquer perigo ao ser humano tem que ser abatido...
video0;negativo;positivo;não;não;neutra;;Nossa pq os familiares não si reuniram e mataram ela. Como deixa isso assim.  O ser humano não vale mais nada né.  Meus pêsames a família enlutada.
video0;neutro;neutro;não;não;neutra;;Palavras tem poder, por isso temos que vigiar no tipo de brincadeira que fazemos, e tomar cuidado com oque falamos.🫤
video0;neutro;neutro;não;não;neutra;;No livro do Apocalipse diz que chegara um tempo que os animais feroz irão comer o povo😢
video0;neutro;positivo;não;não;neutra;;Meus sentimentos
video0;neutro;neutro;não;não;neutra;;Meu Deus a onça pensa igual humano
video0;positivo;negativo;não;não;neutra;;É o território dela. Nao sei porque o ser humano se surpreende se estao dentro habitat  do animal. O triste é que o Sr Jorge nao sentiu medo mesmo vendo o bicho rondando sua casa. O medo é um mecanismo de defesa!
video0;neutro;neutro;não;sim;neutra;;Se tiverem um encontro com um desses animais, entre em contato com o corpo de bombeiros. A pergunta é: Será que dá tempo? 😒🧐
video0;neutro;neutro;não;não;boa;;Parabéns pelo vídeo...
video0;neutro;neutro;não;não;neutra;;Se tivesse um cachorro aí, talvez  a história seria diferente.  E muito importante ter um cachorro em um lugar desse.  O cachorro sente a onça de longe.  😢
video0;negativo;neutro;não;não;neutra;;Bicho ruim
video0;neutro;neutro;não;sim;neutra;;😂😂😂😂😂😂
video0;neutro;neutro;não;não;neutra;;Saia zar😮
video0;negativo;neutro;não;não;neutra;;Infelizmente acredito que deveria ser sacrificada ou colocada em cativeiro, pois sentiu o gosto da carne humana e souta poderá atacar novamente.
video0;positivo;neutro;não;não;neutra;;Sim, capturando a onça vai trazer o rpz de volta!?...deixa a onça em paz moço , não tem mais jeito ,quer botar em uma cadeia e acusar como homicídio!???
video0;neutro;negativo;não;não;neutra;;Se o Jorge tivesse armado a história seria diferente nem a pau que eu ia ficar num lugar desse sem uma arma ainda mais sabendo que tinha onça
video0;neutro;negativo;não;não;neutra;;Jorge não tinha uma arma morando nu lugar desse tem que ter uma arma
video0;neutro;neutro;não;não;neutra;;Se tinha tres pq so pegaram uma pra levar
video0;neutro;neutro;não;sim;neutra;;😂🖕🤙👏
video0;neutro;neutro;não;sim;neutra;;Bom ... lamentável pelo OCORRIDO.. <br>Mais pelo que entendi. .ela foi :<br>Capturada.... Sedada..... Enjaulada.... foi para o o CRAS ( Abrigo ou Dentenção ) ... pensando aqui .. <br>Vai ser julgada pelo CRIME de FELINOCIDIO ? <br>BOm seria se o JUIZ o XANDÃO fizesse o JULGAMENTO do caso.. e falasse FRENTE a FRENTE a DECISÃO <br>Seria bom mesmo
video0;neutro;neutro;não;não;neutra;;Na verdade, ninguém sabe como foi o ataque.
video0;neutro;positivo;não;não;neutra;;Meus Sentimentos 😢
video0;neutro;neutro;não;não;neutra;;A verdade é o seguinte dormiu de costa a onda leva
video0;positivo;neutro;não;não;neutra;;Coitado onça maldita 😔😔😔😔😔😔😢😢😢😢
video0;negativo;neutro;não;não;neutra;;Como dizia vovô é difícil onça atacar o seres humanos mais depois de atacar essa onça vai atacar sempre.
video0;neutro;positivo;não;não;neutra;;Misericórdia Senhor esperou a onça  matar uma pessoa para depois tirar de lá só toma atitude  depois de tragédia que Deus conforte aos familiares e amigos 😢😢
video0;neutro;neutro;não;não;neutra;;Quem garante q é a mesma falaram q havia filmado umas 3 la😮
video0;neutro;neutro;não;não;neutra;;Tem pegadas perto  do tio eu desconfio que é  de onça  mas é  RS será  wue tem
video0;neutro;neutro;não;não;neutra;;Tem capturar os dois que está solto, pq pelo que ouvi o cunhado de Jorge falando eram três.
video0;neutro;neutro;não;não;neutra;;Primeiro tem q acontecer a desgraca pra depois darem o jeito
video0;neutro;neutro;não;não;neutra;;Primeiro tem q acontecer a desgraca pra depois darem o jeito
video0;neutro;neutro;não;sim;neutra;;não tem como trazer a Brasília umas 100 onças dessas e soltar no STF senado congresso e no Planalto?
video0;negativo;neutro;não;não;neutra;;Eu matava na hora
video0;negativo;neutro;sim;não;neutra;;Pelo amor de Deus aqui em Santana de Parnaíba também tá tendo uma onça atrás da escola vão esperar comer alguém aqui também vem Ibama pelo amor de Deus essa onça daqui para um lugar dela mais seguro também ou vocês vai esperar ela comeu uma pessoa aqui também para poder me tirar ela está em Santana de Parnaíba em São Paulo habitando atrás de uma escola cheia de criança tava usando para lá e para cá
video0;neutro;neutro;não;sim;neutra;;Aquele ditado amigo da onça
video0;neutro;neutro;não;não;neutra;;se essa onça tá desnutrida como ela conseguiu pegar esse senhor
video0;negativo;neutro;não;não;neutra;;Mano para que já não mataram a 9nça?
video0;negativo;neutro;não;não;neutra;;Tem que morrer um bicho desse
video0;neutro;neutro;não;não;boa;;Parabéns pelo vídeo, simples e explicativo!
video0;neutro;neutro;não;não;neutra;;Se tem vídeo dela um dia antes do ataque, então tem na noite que ela atacou o seu Jorge né 🥹
video0;neutro;negativo;não;não;neutra;;Meus sentimentos por esse senhor....mas ele deu mole grandão
video0;neutro;neutro;não;não;neutra;;Misericórdia só sobrou os ossos, com os resto das roupas e os sapatos que ainda estavam nos pés. Que morte triste.
video0;neutro;neutro;não;sim;neutra;;😂😂😂 rindo de alguns comentários
video0;neutro;neutro;não;sim;ruim;;Que notícia educativa 😂
video0;neutro;negativo;não;não;neutra;;Gente que perigo, eles já tinham visto as pegadas ,eles já tinham q ficar em alerta
video0;neutro;neutro;não;não;neutra;;E o cuidado com a família do homem que morreu como estão os cuidados com eles?
video0;negativo;neutro;não;sim;neutra;;Em breve vou morar sozinha no mato, lá tem outros tipos de onças menores, vou pesquisar meios de mantê-las longe da casa, Deus me livre de servir de petisco de onça pois sou magrela.☹️
video0;neutro;neutro;não;não;neutra;;Não tem vídeo do ataque?
video0;negativo;neutro;não;não;neutra;;Para q noé foi salvar esses bichinhos ai?, aqui na nossa região também tem algumas rondando por aqui matando animais, vieram junto com as plantações d calipto,e esse papo d q é ambiente delas ,na minha opinião isso não existe,pois Deus fez o mundo,e também nos criou ,a diferença é q nós somos as espécies q c aplimoraram, fizemos nossas melhorias para viver melhor e querendo ou não
video0;neutro;neutro;não;não;neutra;;O homem usava boné não chapéu
video0;neutro;positivo;não;não;neutra;;Tadinho 😢deve ter sofrido muito !Deus conforte os familiares e amigos ..
video0;negativo;neutro;não;não;neutra;;O bicho já comeu gente gostou da carne 😮😮😮😮😮humana
video0;positivo;neutro;não;não;neutra;;Ñ é comum onça comer gente
video0;neutro;positivo;não;não;neutra;;Meus pêsames seu Jorge
video0;neutro;neutro;sim;não;neutra;;Eles não capturou a onça, que matou,pura mentira desses cara, esses idiotas não tem nem ideia qual foi a onça porque nessa região há dezenas dessas.
video0;neutro;neutro;não;não;neutra;;Verdade
video0;negativo;neutro;sim;não;neutra;;Tem que tomar cuidado pq há onça e um predador Letal ela come mesmo. Já morei em Lugares na Bahia q comeu gente. Na época nem celular tinha. Mais desaparecia muitas pessoas principalmente jovens.
video0;neutro;neutro;não;não;neutra;;Dentro de mata não é lugar de casa nem moradia de ninguém
video0;positivo;neutro;não;não;neutra;;Que DEUS me perdoe, não tem que matar o bicho não. Errado é o homem que está invadindo o espaço dos animais. Que diabos o homem vai procurar lá? Os homens tem que sair das florestas lá não é o lugar deles , basta de ganância, basta de matanças. Cada um no seu quadrado!
video0;positivo;neutro;não;não;neutra;;Parabéns pela inguinorancia tira o animal do hitate dele para prender numa jaula
video0;neutro;neutro;não;não;neutra;;Idiotas 😠é lamentável o comentarista ter que falar que onça é um animal selvagem 😠ser humano imbecil!! Deus fez o homem para cuidar dos animais porém tem um espaço entre animais doméstico e selvagem agora ficaram brincando com o perigo  começa de jerico!! Não tenho dó não, procurou achou👉 🐅
video0;positivo;neutro;não;não;neutra;;Realmente as queimadas estao trazendo desequilíbrio a natureza. Nunca ouvi que uma onça comesse ser humano.
video0;neutro;neutro;não;não;neutra;;Se tinha câmeras lá,, porque não mostrou o momento do ataque?
video0;positivo;neutro;não;não;neutra;;Mata essas onça tudo sem misericórdia
video0;neutro;neutro;não;não;neutra;;Como eles tem certeza que foi essa que  matou o caseiro
video0;neutro;positivo;não;não;neutra;;Meus sentimentos aos familiares da vítima 😢 ,e q Deus recolha sua alma
video0;neutro;neutro;não;não;boa;;O verdadeiro, vídeo!!! Parabéns
video0;negativo;negativo;não;não;neutra;;Meu Deus quanta ignorância como morar num lugar deste se andar armado e mesmo assim o salto destes animais é fatal porque eles sabem os sinais vitais das presas..será que eles ñ vê os vídeos da Savana Africana?
video0;neutro;neutro;não;não;neutra;;A quem mora lá já sentiu né Deus mim.perdoa mais teve o dia deles animais se vingar dos humanos já desmatou tudo agora chegou a hora
video0;neutro;neutro;sim;não;neutra;;Não é essa onça, essa está magra como eles mesmos falam, pra quem comeu quase um ser humano inteiro não era pra estar tão debilitada e com tanta fome.... A onça que pegou estava é descansando de barriga cheia esperando a fome bater de novo...
video0;neutro;neutro;não;sim;neutra;;Quando vocês fizer esse tipo de orientação pra população precisam orientar os animais também. 😅😅😅😅😅 Cada um tem que fazer sua parte.
video0;negativo;neutro;não;não;neutra;;Na minha opinião a onça deveria ser sacrificada
video0;negativo;neutro;sim;não;neutra;;Oi o sobrinho dele falou que ela tava atrás de um pé de árvore só esperando ele na hora que ele foi ver os barcos ela já tava indo pra cima dele na arrancada correndo aí ele foi lá pra aquela rampa lá dele tentando ir pra uma cozinha parece aí ela aí ele parou aí a onça pulou
video0;negativo;neutro;não;não;neutra;;Na Canadá, mata ou animal savagem que tinha gosto de sangue.. e acabou.
video0;neutro;neutro;não;não;neutra;;Quem garante que é  justamente essa onça, hein? 😮
video0;negativo;neutro;não;não;neutra;;Eles tian que executar essa onça, se fosse no estados unidos essa onça já estava morta
video0;neutro;neutro;não;não;boa;;Vídeo top, mais um inscrito
video0;neutro;neutro;sim;não;neutra;;E olha que foi uma parda
video0;negativo;neutro;não;não;neutra;;O meu tio foi comido pera uma onça 😭😭e eu nem tinha nasido
video0;negativo;neutro;não;não;neutra;;Onça comeu o português tbm
video0;positivo;neutro;não;não;neutra;;Kkkkkk o ser humano tá no lugar errado e o culpado é a dona do ambiente ? Pra q caçar a onça? Ela tá no ambiente dela, o ser humano q tá no lugar errado, deixem ela
video0;neutro;neutro;não;não;boa;;Ótimo vídeo!👏🏾
video0;negativo;neutro;não;não;neutra;;Tem matar essa onça isos sim <br>Onça nao confio nem a pal
video0;negativo;neutro;não;não;neutra;;Rapaz q doideira, provavelmente ela pegou ele num momento q ele estava distraído.
video0;neutro;neutro;não;não;neutra;;Cadê as outras 2 ?  eram 3 e só pegaram 1 !
video0;neutro;positivo;não;não;neutra;;Tadinho 😢
video0;neutro;neutro;não;sim;neutra;;quimadas pobreza geral......nem a onça acha picanha mais!
video0;neutro;neutro;não;não;neutra;;O Felino nitidamente está com baixo peso. Está magro. Um macho com Só 94kl
video0;positivo;positivo;não;não;neutra;;Com tanto desmatamento e invasão dos territórios deles, acabam sem ter o que caçar pobrezinhos. Pobre homem que tragédia.
video0;neutro;negativo;não;não;neutra;;Lamentável ocorido 😢, mas pela reportagem a onça estava rondando o local a um mês. O certo era ter comunicado a policia ambiental para tomar devidas providências.
video0;neutro;neutro;não;não;neutra;;O PANTANAL NÃO É LUGAR DE SERES HUMANOS VIVER.
video0;negativo;neutro;não;não;neutra;;A vide do ser humano vale mais q a dos bichos era pra ter era matado não cuidado  dele
video0;negativo;neutro;não;não;neutra;;Deveriam abater a onça também
video0;neutro;neutro;não;não;neutra;;A culpa foi só desse senhor que não teve juízo e cuidado 😢 lamentável 😢
video0;neutro;negativo;não;não;neutra;;"Só espero que a onça &quot;resgatada&quot; seja pesquisada e solta novamente no habitat dela! O ser humano sabe bem o porte desses animais e o risco de estarem perto deles, a onça atacou por estar com fome, tanto que se alimentou da caça e ela estava no habitat dela! Então espero que os humanos que pegaram essa onça não façam maldade com ela!! Infelizmente o caseiro perdeu a vida, mas estar presente justamente na região onde ele trabalhava tinha seus riscos! As onças já correm riscos de extinção, fazendeiros mercenários já causam danos demais e ao invés de deixarem as onças quietas, ainda caçam ela pra tirar do habitat natural dela!!!!! Infelizmente o senhor foi atacado, o dono do lugar que se vire pra pagar pra familia do caseiro todos os direitos dele, mas tirar a onça dali pra soltar em outro lugar?!!!! Os seres humanos deveriam ser extintos!"
video0;positivo;neutro;não;sim;neutra;;Sacanagem é a polícia ambiental e o Ibama prender a onça em cativeiro 😂  o animal não tem direito de ser livre... O culpado é o próprio ser humano que toma de conta da área dos animais e desmata tudo
video0;neutro;neutro;não;não;neutra;;Antônio de Freitas Loureiro
video0;neutro;neutro;não;não;neutra;;Funciona assim ó o cara que mora na zona rural ali ele está sujeito a roubo a todo momento devido os implementos agrícolas serem caros venenos coisas e tal para agricultura serem caros ele não pode ter uma arma agora um cara que mora na zona rural ele não se defende só de roubo e sim sedefende também de animais silvestres agora um morador da zona rural não pode portar uma arma enquanto nas comunidades apoiados pelo nosso sistema tem até armamento de guerra
video0;neutro;neutro;não;não;neutra;;Essa onça não tem características que comeu alguém está magra tadinha deve ser outra
video0;neutro;neutro;sim;não;neutra;;História muito mal contada... esse cara foi morto por outra pessoa e estão colocando a culpa no bicho... deixaram os restos mortais pra atrair a onça e dar ibope pra mídia !!!
video0;neutro;negativo;não;não;neutra;;sinto partir o 💔ele infelizmente entregou sua confianca acreditando que nada acontecetia 😢que Eterno Deus de o descanso pra alma do seu Jorge 😢😢😢😢
video0;negativo;neutro;não;não;neutra;;Vocês vão me desculpar mas eu não vejo utilidade nenhuma para preservar a onça para guardar a onça
video0;negativo;neutro;não;não;neutra;;O que eu acho interessante é que tem pessoas que fica defendendo onça que fica ai meu Deus as bichinhas tá bom dessas pessoas que fica defendendo a onça botar dentro de casa para criar ela dentro de casa sabe por quê eu não vejo utilidade nenhuma de onça eu não vejo utilidade nenhuma para preservar onça eu não vejo pelo contrário eu vejo comendo os animais aí você é bonito prejudicando o ser humano aí eu quero que o pessoal diga para quê preservarmos que eu não vejo utilidade preservar onça
video0;neutro;neutro;não;sim;neutra;;Se der tempo avisar.
video0;neutro;neutro;não;não;neutra;;❤❤❤❤
video0;positivo;neutro;não;não;neutra;;A culpa não é do animal, mas do homem que invade o habitat dela !!!!
video0;neutro;negativo;não;sim;neutra;;Engraçado que os  humanos mora no meio da mata e os animais moram na cidade , não entendo , como pode construir uma casa assim , mas doido ainda que mora num lugar deste .
video0;negativo;neutro;sim;não;neutra;;Vão fazer o quê agora com a onça?? A onça já está procurando outra vítima.
video0;neutro;neutro;não;não;neutra;;Que triste acontecimento
video0;neutro;neutro;não;sim;neutra;;Pq no congresso ela não vai 😡😡
video0;neutro;neutro;não;não;ruim;;Bando de mentiroso
video0;neutro;neutro;não;não;neutra;;"<a href=""https://www.youtube.com/watch?v=CUf1T3dPFj4&amp;t=460"">7:40</a> onca pintada"
video0;positivo;neutro;não;sim;neutra;;Parabéns pra onça
video0;positivo;negativo;não;não;neutra;;Ele estava na casa da onça ou seja a onça não está errada, agiu por instinto.
video0;neutro;positivo;não;não;neutra;;Meu Deus muito triste que tragédia  que Deus conforte os corações dos  familiares e amigos
video0;neutro;neutro;não;não;neutra;;A natureza não é bela. A natureza é cruel e implacável. Respeite a natureza
video0;neutro;neutro;não;sim;neutra;;Quero saber que dia essa onca chega lá no congresso
video0;neutro;neutro;não;não;boa;;Ótima reportagem! Parabéns!
video0;neutro;neutro;não;não;neutra;;😢😢😢😢😢😢😢
video0;neutro;neutro;não;não;neutra;;Pode pegar uma onça doente contra um homem forte e com habilidades de luta, que ainda assim, a onça doente mata facilmente o homem. Quem dirá uma onça saudável de quase 100kg !! Não da nem pra ela brincar ....
video0;neutro;neutro;não;sim;neutra;;Pior q a q tem muitas 😂😂
video0;negativo;neutro;não;não;neutra;;Ela tira uma vida e continua viva,kk,a família é que sofre por causa de uma merda dessa
video0;positivo;negativo;não;não;neutra;;Humanos, deixem esse lugar para os animais! É o lar deles
video0;neutro;neutro;não;não;neutra;;Larga de ser ingenua!
video0;neutro;neutro;não;não;neutra;;Sua opinião mudaria se fosse um parente seu.
video0;neutro;neutro;não;não;neutra;;mui angustiante esse fim do caseiro
video0;positivo;neutro;não;não;neutra;;Agora o animal tem culpa de estar no seu habitat natural e apenas seguindo sua cadeia alimentar.
video0;neutro;neutro;não;não;neutra;;Que tristeza.
video0;neutro;neutro;não;não;neutra;;BOM NA MINHA VERSSAO ELE JA TERIA VISTO MEU AVO NA EPOCA ERA FASENDEIRO OS TODOS ONCA ERA VISTA UMA VES NAGLEBA PAIXAO EM MATO GROSSO DO SUL CASA FEITA DE TAIPA TANBEM ERA UMA VES OK RUDIANDO A CASA QUEIXADAS OK NO OUTRO DIA ELES OK TURQUIA  FORTE E MATAVA TODOS TINHA PLANTIO GADOS BEZERROS OKMEU EOS AGREGADOS NAO DAVA MOLESA PRA ONCA SER HUMANO NEMHUM SUPORTA. ONCAOK DEU MOLE COM NAO PODE AMANCOU ELE ESSE BICHOS PREDADORES ELES DE MANCINHO IGUAL PECADO OK E VIGILANCIA ELES NAO BRINCA OKBOA EU SE FOSSE PRA TER FASENDA RUDIAVA DE SERCA ELETRICA OK NINGUEM NUMA FASENDA ABERTA A DEUS DARA OK A MINHA AI DO TIKTOK REDE VISINHA RUDIOU O SITIO DE SERCA ELETRICA AINDA TEM APARELHO QUE DENTIFICA SE PEGOU OU ESTA MAIS PRA COMER SER HUMANO QUE ISSO TADOIDO DORMIU COM OLHO DA ONCA OK
video0;neutro;negativo;não;não;neutra;;Ontem a noite sofri  insonia pensando na mote triste sesse caseiro. Infelizmente ele nao se precaveu do perigo... nao precisava ter esse fim mas ele brincou com essa hipótese.
video0;positivo;neutro;não;não;neutra;;Não  e a onça  que está  no lugar errado são  as pessoas que estão  no lugar delas!!!
video0;neutro;neutro;não;sim;neutra;;SOLTEM ELE COM O BOLSONARO MENTIROSO🦌🦌🦌🦌🦌🦌🦌➡️➡️➡️➡️
video0;neutro;neutro;não;não;neutra;;Cunhado inocente falando onça vai te comer, palavras tem poder
video0;neutro;neutro;não;sim;neutra;;Coitado. Morreu com a Pintada…
video0;neutro;neutro;não;sim;neutra;;Essa equipe não pega nem uma sardinha, pegaram a onça.
video0;neutro;neutro;não;sim;neutra;;Força tarefa na  busca pela onça , e???? irá para julgamento??? Como no comentário do @wandão.067 já estava duvidando que a onça capturada seria a mesma. Como provar isso.
video0;neutro;neutro;não;não;neutra;;Pelo o que vejo tem mais valor a onça  do que o seu jorge
video0;negativo;neutro;não;não;neutra;;Inacreditável kkkkkk como seres humanos são burros, falam que invadimos território dos bicho mais os cara não percebe que para morar no barraco que moram vários animais perderam seu lares, são hipocritas e burros…eu quero é que se foda, se o bicho fornece risco a seres humanos tem que matar mesmo, capaz que vou ficar de papinho de poupar um animal que pode ceifar a vida de um pai, esposo ou filho
video0;neutro;negativo;não;não;neutra;;Quando ele notou as pegadas já pela primeira vez tão perto da casa, deveria já ter acionado o guarda florestal ou o órgão que cuida disso,  para fazer a captura dela. Com certeza ele foi imprudente achando que nada aconteceria. E pelo jeito estava faminta há dias
video0;positivo;positivo;não;não;neutra;;Bichona linda, mas infelizmente uma vida se foi.
video0;positivo;positivo;não;não;neutra;;Bichona linda, mas infelizmente uma vida se foi.
video0;neutro;neutro;não;não;boa;;Ótimo vídeo!<br>(Só lembrando que se fizéssemos uma régua entre picada de mosquito q mata e onça, o da onça perde né) Dengue mata pra cacete!
video0;positivo;neutro;não;não;neutra;;Tudo é culpa nossa mesmo. Estamos invadindo os territórios dos animais pra obter cada vez mais lucros na exploração das terras, diminuindo os recursos de sobrevivência deles.
video0;neutro;neutro;não;não;neutra;;Triste 😢
video0;neutro;neutro;não;não;neutra;;Quer dizer que agora todos nós que vive da roça mora na roça vai ter que mudar pra Cida por causa de onça é brincadeira viu
video0;neutro;positivo;não;não;neutra;;Meus sentimentos aos familiares ! Agora precisam preservar a vids dos que moram na regiao pois os trabalhadores nao podem viver  com essa vulnerabilidade . Sei aue muitos irao criticar minha opnião mais se a trabalho nessa regiao tem que haver protecao e mais respeito aos trabalhadores . Porque com certeza os fazendeiros teriam enchido ela de bala .  Mais uma vez lamento a perda aos familiares .
video0;neutro;neutro;não;não;neutra;;Mais se ela comeu o homem como ela está tão magra
video0;neutro;neutro;não;não;neutra;;Morrer em si é triste,mas morrer assim é horrível 😢😢😢😢
video0;neutro;neutro;não;não;neutra;;Alguém tem o vídeo sem censura ?
video0;neutro;neutro;não;não;neutra;;Jesus e Deus ti ama muito e sempre estarão com você jesus Cristo pode voltar a qualquer hora se arrependam dos seus pecados enquanto há um tempo nunca desista da sua vida seja grato a Deus por tudo que vocês tem leiam os salmos 23,3,4,91 da bíblia podem ajudar
video0;neutro;neutro;não;não;neutra;;Essa onça que atacou o velhinho, e as outras já devem ter sido mortas... As autoridades adoram matar onças, quem não lembra da onça Juma na época das olimpíadas... Já nos os seres humanos adoramos a vingança, ... Então é bem certo que o negócio ficou ruim para as onças nesses últimos Dias
video0;neutro;neutro;não;sim;neutra;;Quem mata é o onço mas quem leva a fama de ruim é a onça.
video0;neutro;neutro;não;não;neutra;;🇧🇷
video0;neutro;negativo;não;não;neutra;;Ficar sabendo de rastro se afasta logo tenha cuidado isso não é bicho de brincar não
video0;neutro;negativo;não;não;neutra;;Culpa do homêm ele caça a comida das onças e elas vêm atrás de comida
video0;negativo;neutro;não;não;neutra;;Perder a vida por uma onça na sua morada  ?
video0;neutro;neutro;não;sim;neutra;;Uma dessa dessa dentro da alas de todos os presídios do Brasil seria excelente
